[{
  "_id": {
    "$oid": "6810b723c44aaaea9d156338"
  },
  "id_Cliente": 1,
  "nombre": "Pepe",
  "apellidos": "Pérez García",
  "direccion_postal": "Calle Primavera 123, Madrid",
  "telefono": "911234567",
  "correo_electronico": "pepe.perez@example.com",
  "fecha_de_Registro": {
    "$date": "2023-01-15T00:00:00.000Z"
  },
  "recomendado_por": 0
},
{
  "_id": {
    "$oid": "6810b7e4c44aaaea9d15633a"
  },
  "id_Cliente": 2,
  "nombre": "María",
  "apellidos": "López Fernández",
  "direccion_postal": "Avenida Libertad 45, Barcelona",
  "telefono": "932345678",
  "correo_electronico": "maria.lopez@example.com",
  "fecha_de_Registro": {
    "$date": "2023-02-15T00:00:00.000Z"
  },
  "recomendado_por": 1
},
{
  "_id": {
    "$oid": "6810b7e4c44aaaea9d15633b"
  },
  "id_Cliente": 3,
  "nombre": "Carlos",
  "apellidos": "Martínez Ruiz",
  "direccion_postal": "Plaza Mayor 7, Valencia",
  "telefono": "963456789",
  "correo_electronico": "carlos.martinez@example.com",
  "fecha_de_Registro": {
    "$date": "2023-03-20T00:00:00.000Z"
  },
  "recomendado_por": 0
},
{
  "_id": {
    "$oid": "6810b7e4c44aaaea9d15633c"
  },
  "id_Cliente": 4,
  "nombre": "Ana",
  "apellidos": "Gómez Sánchez",
  "direccion_postal": "Calle del Sol 89, Sevilla",
  "telefono": "954567890",
  "correo_electronico": "ana.gomez@example.com",
  "fecha_de_Registro": {
    "$date": "2023-04-05T00:00:00.000Z"
  },
  "recomendado_por": 2
},
{
  "_id": {
    "$oid": "6810b7e4c44aaaea9d15633d"
  },
  "id_Cliente": 5,
  "nombre": "Javier",
  "apellidos": "Rodríguez Pérez",
  "direccion_postal": "Paseo Marítimo 12, Málaga",
  "telefono": "951678901",
  "correo_electronico": "javier.rodriguez@example.com",
  "fecha_de_Registro": {
    "$date": "2023-05-12T00:00:00.000Z"
  },
  "recomendado_por": 1
},
{
  "_id": {
    "$oid": "6810b7e4c44aaaea9d15633e"
  },
  "id_Cliente": 6,
  "nombre": "Lucía",
  "apellidos": "Hernández Martín",
  "direccion_postal": "Calle Luna 34, Bilbao",
  "telefono": "944789012",
  "correo_electronico": "lucia.hernandez@example.com",
  "fecha_de_Registro": {
    "$date": "2023-06-18T00:00:00.000Z"
  },
  "recomendado_por": 3
}]